{
  "version": "2.0",
  "has_ciclo": false,
  "facultades": [
    "Facultad de Ciencias Empresariales",
    "Facultad de Comunicación",
    "Facultad de Ingeniería"
  ],
  "carreras": [
    "Administración",
    "Comunicación",
    "Ingeniería Ambiental",
    "Ingeniería Civil",
    "Ingeniería Industrial"
  ],
  "ciclos": [],
  "facultad_carrera": {
    "Facultad de Ciencias Empresariales": [
      "Administración"
    ],
    "Facultad de Comunicación": [
      "Comunicación"
    ],
    "Facultad de Ingeniería": [
      "Ingeniería Ambiental",
      "Ingeniería Civil",
      "Ingeniería Industrial"
    ]
  }
}